{
 "id": "human-1-12",
 "race": "Human",
 "faction": "Alliance",
 "levelRange": [
  1,
  12
 ],
 "generatedAt": "2026-10-22T12:00:00Z",
 "dataBuild": "1.60.1.70532",
 "reviewed": false,
 "releaseTier": "beta",
 "steps": [
  {
   "id": "s1",
   "type": "turnin",
   "mapId": 1429,
   "x": 48.2,
   "y": 41.7,
   "confidence": "cross-checked",
   "questId": 33,
   "npcId": 196
  }
 ]
}
