{
 "id": "human-1-12",
 "race": "Human",
 "faction": "Alliance",
 "levelRange": [
  1,
  12
 ],
 "generatedAt": "2026-10-22T12:00:00Z",
 "dataBuild": "1.60.1.70532",
 "reviewed": false,
 "releaseTier": "full",
 "steps": [
  {
   "id": "s1",
   "type": "accept",
   "mapId": 1429,
   "x": 48.2,
   "y": 41.7,
   "confidence": "cross-checked",
   "questId": 300,
   "npcId": 5
  },
  {
   "id": "s2",
   "type": "turnin",
   "mapId": 1429,
   "x": 48.2,
   "y": 41.7,
   "confidence": "cross-checked",
   "questId": 300,
   "npcId": 5
  },
  {
   "id": "s3",
   "type": "gap",
   "mapId": 1429,
   "x": 48.2,
   "y": 41.7,
   "confidence": "unverified",
   "reason": "no data"
  }
 ]
}
