{
  "id": "human-1-12",
  "race": "Human",
  "faction": "Alliance",
  "levelRange": [1, 12],
  "generatedAt": "2026-10-22T12:00:00Z",
  "dataBuild": "1.60.1.70532",
  "reviewed": false,
  "releaseTier": "beta",
  "steps": [
    {"id": "s1", "type": "accept", "mapId": 1429, "x": 48.2, "y": 41.7, "questId": 783, "npcId": 823, "confidence": "cross-checked"},
    {"id": "s2", "type": "complete", "mapId": 1429, "x": 48.2, "y": 41.7, "questId": 33, "confidence": "cross-checked"},
    {"id": "s3", "type": "turnin", "mapId": 1429, "x": 48.2, "y": 41.7, "questId": 33, "npcId": 196, "confidence": "cross-checked"}
  ]
}
